{
  "schema_version": "1.0",
  "run_id": "2026-10-15T07-30-00_a1b2c3",
  "created_utc": "2026-10-15T07:30:00Z",
  "razkadr_version": "0.0.1",
  "config_hash": "1f2e3d4c5b6a798809172635445362718f9e0d1c2b3a49586776655443322110",
  "tool_versions": { "ffmpeg": "7.1.5", "python": "3.12" },
  "stages": [
    { "name": "ingest", "status": "ok", "started_utc": "2026-10-15T07:30:01Z", "duration_s": 3.2 },
    { "name": "frames", "status": "ok", "started_utc": "2026-10-15T07:30:04Z", "duration_s": 41.7 },
    { "name": "transcript", "status": "cached", "started_utc": "2026-10-15T07:30:46Z", "duration_s": 0.1 },
    { "name": "index", "status": "failed", "started_utc": "2026-10-15T07:30:46Z", "duration_s": 1.0, "error": "provider rate limit exceeded" }
  ],
  "provider_calls": [
    {
      "stage": "transcript",
      "provider": "deepgram",
      "model": "nova-2",
      "task": "asr",
      "units": [ { "kind": "seconds", "value": 840.5 } ],
      "cost": { "amount": 0.42, "currency": "USD", "tariff_date": "2026-10-01" },
      "cache_hit": true
    },
    {
      "stage": "index",
      "provider": "openai",
      "model": "text-embedding-3-small",
      "task": "embed",
      "units": [ { "kind": "images", "value": 96 }, { "kind": "tokens", "value": 15360 } ],
      "cost": { "amount": 0.0031, "currency": "USD", "tariff_date": "2026-10-01" },
      "cache_hit": false
    }
  ]
}
